{
  "version": "1.0.0",
  "themes": {
    "default": "dark",
    "variants": ["dark", "light"]
  },
  "colors": [
    {
      "name": "primary",
      "description": "Primary foreground/text color for emphasis.",
      "values": {
        "dark": "#e8eaed",
        "light": "#15171a"
      }
    },
    {
      "name": "secondary",
      "description": "Secondary text color for de-emphasized content.",
      "values": {
        "dark": "#9aa0ab",
        "light": "#626872"
      }
    },
    {
      "name": "tertiary",
      "description": "Accent color for links, active states, and brand emphasis.",
      "values": {
        "dark": "#9b6dff",
        "light": "#7c4dff"
      }
    },
    {
      "name": "neutral",
      "description": "Base background color behind surfaces.",
      "values": {
        "dark": "#1a1c1f",
        "light": "#f5f7f8"
      }
    },
    {
      "name": "surface",
      "description": "Primary surface/card background.",
      "values": {
        "dark": "#222428",
        "light": "#ffffff"
      }
    },
    {
      "name": "surface-muted",
      "description": "Muted surface for secondary panels.",
      "values": {
        "dark": "#2c2f35",
        "light": "#eceff3"
      }
    },
    {
      "name": "on-primary",
      "description": "Text/icon color on top of the primary color.",
      "values": {
        "dark": "#1a1c1f",
        "light": "#ffffff"
      }
    },
    {
      "name": "on-surface",
      "description": "Text/icon color on top of the surface color.",
      "values": {
        "dark": "#e8eaed",
        "light": "#15171a"
      }
    },
    {
      "name": "border",
      "description": "Border and divider color.",
      "values": {
        "dark": "#3a3f48",
        "light": "#d8dee6"
      }
    },
    {
      "name": "info",
      "description": "Informational accent color.",
      "values": {
        "dark": "#5b9cf5",
        "light": "#2563eb"
      }
    },
    {
      "name": "success",
      "description": "Success state color.",
      "values": {
        "dark": "#3ebd82",
        "light": "#0f8a5f"
      }
    },
    {
      "name": "warning",
      "description": "Warning state color.",
      "values": {
        "dark": "#d4a735",
        "light": "#b7791f"
      }
    },
    {
      "name": "danger",
      "description": "Error/danger state color.",
      "values": {
        "dark": "#e8594e",
        "light": "#b42318"
      }
    },
    {
      "name": "code-bg",
      "description": "Code block background.",
      "values": {
        "dark": "#2c2f35",
        "light": "#eceff3"
      }
    },
    {
      "name": "code-text",
      "description": "Code block text color.",
      "values": {
        "dark": "#e8eaed",
        "light": "#15171a"
      }
    },
    {
      "name": "blockquote-border",
      "description": "Blockquote left border color.",
      "values": {
        "dark": "#3a3f48",
        "light": "#d8dee6"
      }
    },
    {
      "name": "blockquote-text",
      "description": "Blockquote text color.",
      "values": {
        "dark": "#9aa0ab",
        "light": "#626872"
      }
    },
    {
      "name": "table-border",
      "description": "Table cell border color.",
      "values": {
        "dark": "#3a3f48",
        "light": "#d8dee6"
      }
    },
    {
      "name": "table-header-bg",
      "description": "Table header row background.",
      "values": {
        "dark": "#2c2f35",
        "light": "#eceff3"
      }
    },
    {
      "name": "link",
      "description": "Link text color.",
      "values": {
        "dark": "#9b6dff",
        "light": "#7c4dff"
      }
    },
    {
      "name": "link-hover",
      "description": "Link text color on hover.",
      "values": {
        "dark": "#b794ff",
        "light": "#9b6dff"
      }
    },
    {
      "name": "selection-bg",
      "description": "Text selection highlight color (rgba for translucency).",
      "values": {
        "dark": "rgba(155,109,255,0.3)",
        "light": "rgba(124,77,255,0.15)"
      }
    },
    {
      "name": "scrollbar-thumb",
      "description": "Scrollbar thumb color.",
      "values": {
        "dark": "#3a3f48",
        "light": "#d8dee6"
      }
    },
    {
      "name": "scrollbar-track",
      "description": "Scrollbar track color.",
      "values": {
        "dark": "transparent",
        "light": "transparent"
      }
    },
    {
      "name": "outline-depth-0",
      "description": "Outline depth-0 heading color.",
      "values": {
        "dark": "#e8eaed",
        "light": "#15171a"
      }
    },
    {
      "name": "outline-depth-1",
      "description": "Outline depth-1 heading color.",
      "values": {
        "dark": "#e8eaed",
        "light": "#15171a"
      }
    },
    {
      "name": "outline-depth-2",
      "description": "Outline depth-2 heading color.",
      "values": {
        "dark": "#9aa0ab",
        "light": "#626872"
      }
    },
    {
      "name": "outline-depth-3",
      "description": "Outline depth-3+ heading color.",
      "values": {
        "dark": "#6b7280",
        "light": "#808890"
      }
    },
    {
      "name": "outline-active-bg",
      "description": "Outline active item background (rgba for translucency).",
      "values": {
        "dark": "rgba(155,109,255,0.12)",
        "light": "rgba(124,77,255,0.1)"
      }
    },
    {
      "name": "outline-active-border",
      "description": "Outline active item border color.",
      "values": {
        "dark": "#9b6dff",
        "light": "#7c4dff"
      }
    }
  ],
  "semanticColors": [
    {
      "name": "heading",
      "description": "Heading text color.",
      "reference": "primary"
    },
    {
      "name": "body",
      "description": "Body text color.",
      "reference": "on-surface"
    },
    {
      "name": "muted",
      "description": "Muted/de-emphasized text color.",
      "reference": "secondary"
    },
    {
      "name": "accent",
      "description": "Brand accent color.",
      "reference": "tertiary"
    },
    {
      "name": "background",
      "description": "App background color.",
      "reference": "neutral"
    },
    {
      "name": "card",
      "description": "Card/panel background.",
      "reference": "surface"
    }
  ],
  "typography": {
    "fontFamilies": [
      {
        "name": "body",
        "value": "\"Inter\", system-ui, -apple-system, sans-serif",
        "unityFallback": "Inter"
      },
      {
        "name": "mono",
        "value": "\"SF Mono\", \"Fira Code\", \"Cascadia Code\", \"JetBrains Mono\", monospace",
        "unityFallback": "Roboto Mono"
      }
    ],
    "fontSizes": [
      { "name": "headline-lg", "value": "34px" },
      { "name": "headline-md", "value": "24px" },
      { "name": "h3", "value": "20px" },
      { "name": "body-md", "value": "17px" },
      { "name": "h4", "value": "17px" },
      { "name": "body-sm", "value": "14px" },
      { "name": "code-md", "value": "14px" },
      { "name": "label-caps", "value": "12px" },
      { "name": "h5", "value": "14px" },
      { "name": "h6", "value": "14px" }
    ],
    "fontWeights": [
      { "name": "headline-lg", "value": 700 },
      { "name": "headline-md", "value": 650 },
      { "name": "label-caps", "value": 650 }
    ],
    "lineHeights": [
      { "name": "headline-lg", "value": 1.12 },
      { "name": "headline-md", "value": 1.2 },
      { "name": "body-md", "value": 1.62 },
      { "name": "body-sm", "value": 1.5 },
      { "name": "code-md", "value": 1.55 }
    ],
    "letterSpacings": [{ "name": "label-caps", "value": "0.08em" }]
  },
  "spacing": [
    { "name": "xs", "value": "4px" },
    { "name": "sm", "value": "8px" },
    { "name": "md", "value": "16px" },
    { "name": "lg", "value": "24px" },
    { "name": "xl", "value": "36px" },
    { "name": "xxl", "value": "56px" }
  ],
  "radii": [
    { "name": "sm", "value": "6px" },
    { "name": "md", "value": "8px" },
    { "name": "lg", "value": "12px" },
    { "name": "xl", "value": "16px" },
    { "name": "full", "value": "9999px" }
  ],
  "widths": [
    { "name": "content-max", "value": "800px" },
    { "name": "toolbar-height", "value": "48px" },
    { "name": "sidebar-width", "value": "240px" },
    { "name": "toggle-width", "value": "20px" }
  ],
  "motion": {
    "durations": [
      { "name": "fast", "value": "150ms" },
      { "name": "normal", "value": "250ms" },
      { "name": "slow", "value": "400ms" }
    ],
    "easings": [
      { "name": "ease", "value": "ease" },
      { "name": "ease-in", "value": "ease-in" },
      { "name": "ease-out", "value": "ease-out" },
      { "name": "ease-in-out", "value": "ease-in-out" }
    ]
  },
  "accessibility": {
    "reducedMotion": {
      "query": "(prefers-reduced-motion: reduce)",
      "durationOverride": "0.01ms",
      "iterationOverride": "1"
    },
    "focusOutline": {
      "width": "2px",
      "style": "solid",
      "colorToken": "tertiary"
    }
  },
  "platformExceptions": [
    {
      "token": "selection-bg",
      "platform": "unity",
      "reason": "Unity UIToolkit does not support rgba() with alpha in USS color properties. Use a solid color with the closest perceptual match.",
      "webValue": "rgba(155,109,255,0.3)",
      "platformValue": "#9b6dff"
    },
    {
      "token": "outline-active-bg",
      "platform": "unity",
      "reason": "Unity UIToolkit does not support rgba() with alpha in USS color properties. Use a solid color with the closest perceptual match.",
      "webValue": "rgba(155,109,255,0.12)",
      "platformValue": "#2c2f35"
    },
    {
      "token": "scrollbar-track",
      "platform": "unity",
      "reason": "Unity UIToolkit scrollbars are styled via ScrollView USS, not a CSS custom property. Transparent track maps to the surface background.",
      "webValue": "transparent",
      "platformValue": "#222428"
    },
    {
      "token": "font-body",
      "platform": "unity",